{
  "grantID": "22222222-2222-4222-8222-222222222222",
  "rootGrantID": "11111111-1111-4111-8111-111111111111",
  "operations": ["upload", "update"],
  "relativePathPrefixes": ["approved"],
  "maximumBytes": 1048576,
  "issuedAt": "2099-01-01T00:00:00.000Z",
  "expiresAt": "2099-01-01T00:15:00.000Z",
  "approvalReference": "APR-REPLACE-ME"
}
